{
  "anomaly_detected": true,
  "confidence_score": 0.86,
  "anomaly_type": "volume_spike",
  "reasoning": "Short-horizon volume anomaly with supporting market evidence.",
  "recommended_trade": "BUY_YES",
  "recommended_position_size_pct": 0.08,
  "risk_level": "medium",
  "holding_period_hours": 24,
  "supporting_evidence": [
    "6.2x volume spike",
    "Short time horizon"
  ],
  "counter_evidence": [
    "No confirmed whale concentration"
  ]
}